title,author,price,avg_reviews
Becoming a Data Head: How to Think Speak and Understand Data Science Statistics and Machine Learning,"[Alex J. Gutman,Jordan Goldmeier]",24.49,4.6
Ace the Data Science Interview: 201 Real Interview Questions Asked FAANG Tech Startups & Wall Street,"[Nick Singh,Kevin Huo]",26,4.5
Fundamentals of Data Engineering: Plan and Build Robust Data Systems,"[Joe Reis,Matt Housley]",50.76,5
Essential Math for Data Science: Take Control of Your Data with Fundamental Linear Algebra Probability and Statistics,[Thomas Nield],44.8,4.5
Data Science for Business: What You Need to Know about Data Mining and Data-Analytic Thinking,"[Foster Provost,Tom Fawcett]",36.99,4.5
Data Science from Scratch: First Principles with Python,[Joel Grus],45.22,4.4
Practical Statistics for Data Scientists: 50+ Essential Concepts Using R and Python,"[Peter Bruce,Andrew Bruce et al.]",24.88,4.6
Python for Data Science: A Hands-On Introduction,[Yuli Vasiliev],28.49,4.3
Practical Linear Algebra for Data Science: From Core Concepts to Applications Using Python,[Mike Cohen],69.99,
Data Science (The MIT Press Essential Knowledge series),,9.61,4.5
Data Science For Dummies (For Dummies (Computer/Tech)),[Lillian Pierson],25.49,4.6
Azure Data Engineer Associate Certification Guide: A hands-on reference guide to developing your data engineering skills and preparing for the DP-203 exam,[Newton Alex],49.99,4.1
Data Pipelines with Apache Airflow,"[Bas P. Harenslak,Julian Rutger de Ruiter]",47.62,4.7
Practical Data Science with Python: Learn tools and techniques from hands-on examples to extract insights from data,[Nathan George],51.99,4.7
Data Science on AWS: Implementing End-to-End Continuous AI and Machine Learning Pipelines,"[Chris Fregly,Antje Barth]",31.99,4.4
Data Analysis for Business Economics and Policy,,61.74,4.4
Machine Learning Design Interview: Machine Learning System Design Interview,[Khang Pham],34.15,3.6
Hands-On Data Analysis with Pandas: A Python data science handbook for data collection wrangling analysis and visualization 2nd Edition,"[Stefanie Molin,Ken Jee]",35.67,4.3
Business Data Science: Combining Machine Learning and Economics to Optimize Automate and Accelerate Business Decisions,[Matt Taddy],33.43,4.5
The Art of Statistics: How to Learn from Data,[David Spiegelhalter],17.99,4.6
Cleaning Data for Effective Data Science: Doing the other 80% of the work with Python R and command-line tools,[David Mertz],39.99,4.8
Everything Data Analytics-A Beginners Guide to Data Literacy: Understanding the Processes That Turn Data Into Insights (Guides for Data Analytics Data Visualization and Communicating Data),,14.49,4.2
Effective Data Science Infrastructure: How to make data scientists productive,[Ville Tuulos],49.99,5
Python Data Science Handbook: Essential Tools for Working with Data,[Jake VanderPlas],66.49,
The Enterprise Big Data Lake: Delivering the Promise of Big Data and Data Science,[Alex Gorelik],40.1,4.3
Data-Driven Science and Engineering: Machine Learning Dynamical Systems and Control,"[Steven L. Brunton,J. Nathan Kutz]",58.49,4.6
Hands-On Data Science for Marketing: Improve your marketing strategies with machine learning using Python and R,[Yoon Hyup Hwang],44.99,4.3
Be Data Driven: How Organizations Can Harness the Power of Data,[Jordan Morrow],34.99,5
Data Science Projects with Python: A case study approach to gaining valuable insights from real data with machine learning 2nd Edition,[Stephen Klosterman],36.99,4.6
The Kaggle Book: Data analysis and machine learning for competitive data science,"[Konrad Banachewicz,Luca Massaron et al.]",39.94,4.6
Think Like a Data Scientist: Tackle the data science process step--step,[Brian Godsey],29.59,4.5
Designing Data-Intensive Applications: The Big Ideas Behind Reliable Scalable and Maintainable Systems,[Martin Kleppmann],23.37,4.8
Data Smart: Using Data Science to Transform Information into Insight,[John W. Foreman],21.1,4.5
Python for Data Analysis: Data Wrangling with pandas NumPy and Jupyter,[Wes McKinney],62.99,5
Modern Data Science with R (Chapman & Hall/CRC Texts in Statistical Science),,72.59,3.9
Machine Learning: 4 Books in 1: The #1 Beginners Guide to Master the Basics of Python Programming Learn the Art of Data Science and Build Artificial Intelligence,[Andrew Park],25.97,4.6
Building Big Data Pipelines with Apache Beam: Use a single programming model for both batch and stream data processing,[Jan Lukavsky],46.99,3.9
Algorithmic Finance: A Companion To Data Science,[Christopher Hian-ann Ting],116.85,
Naked Statistics: Stripping the Dread from the Data,,11.69,4.6
Bayesian Ideas and Data Analysis: An Introduction for Scientists and Statisticians (Chapman & Hall/CRC Texts in Statistical Science),,64.1,4
Julia Data Science,"[Jose Storopoli,Rik Huijzer et al.]",31.99,4.5
Listening to People: A Practical Guide to Interviewing Participant Observation Data Analysis and Writing It All Up (Chicago Guides to Writing Editing and Publishing),,19,4.5
Doing Data Science: Straight Talk from the Frontline,"[""Cathy ONeil"",Rachel Schutt]",26.3,4.3
Microsoft Power BI Quick Start Guide: Bring your data to life through data modeling visualization digital storytelling and more 2nd Edition,"[Devin Knight,Mitchell Pearson et al.]",28.49,4.3
R in Action Third Edition: Data analysis and graphics with R and Tidyverse,[Robert I. Kabacoff],56.99,4.6
Data Science Ethics: Concepts Techniques and Cautionary Tales,[David Martens],37.2,5
Data Science and Machine Learning: Mathematical and Statistical Methods (Chapman & Hall/CRC Machine Learning & Pattern Recognition),,77.43,4.8
Data Mesh in Action,"[Jacek Majchrzak,Sven Balnojan et al.]",69.99,
The Machine Learning Solutions Architect Handbook: Create machine learning platforms to run solutions in an enterprise setting,[David Ping],43.97,4.7
Practical Big Data Analytics: Hands-on techniques to implement enterprise analytics and machine learning using Hadoop Spark NoSQL and R,[Nataraj Dasgupta],44.99,3.8
Simplify Big Data Analytics with Amazon EMR: A beginners guide to learning and implementing Amazon EMR for building data analytics solutions,[Sakti Mishra],46.99,5
Bootstrap:Data Science Workbook,"[Emmanuel Schanzer,Kathi Fisler et al.]",4.73,
Amazon Redshift Cookbook: Recipes for building modern data warehousing solutions,"[Shruti Worlikar,Thiyagarajan Arumugam et al.]",51.99,4.5
SQL for Data Analytics: Harness the power of SQL to extract insights from data 3rd Edition,"[Jun Shan,Matt Goldwasser et al.]",44.99,5
Communicating with Data: Making Your Case With Data,[Carl Allchin],40.99,5
Data Analytics: A Small Data Approach (Chapman & Hall/CRC Data Science Series),,89.95,5
Data Structures the Fun Way: An Amusing Adventure with Coffee-Filled Examples,[Jeremy Kubica],29.99,
Data Analysis with R - Second Edition: A comprehensive guide to manipulating analyzing and visualizing data in R,[Tony Fischetti],38.82,4.4
Data Engineering with AWS: Learn how to design and build cloud-based data transformation pipelines using AWS,[Gareth Eagar],39.99,4.4
Data Science: Advanced Guide to Learn the Realms of Data Science Effectively,[Benjamin Smith],19.99,
Data Science for Supply Chain Forecasting,[Nicolas Vandeput],49.39,4.6
Heard In Data Science Interviews: Over 650 Most Commonly Asked Interview Questions & Answers,[Kal Mishra],37.99,3.2
DATA ANALYTICS: A Comprehensive Beginner’s Guide To Learn About The Realms Of Data Analytics From A-Z,[Mr Benjamin Smith],19.99,4.2
Introduction to Data Science: Data Analysis and Prediction Algorithms with R (Chapman & Hall/CRC Data Science Series),,77.28,4.8
Introduction to Machine Learning with R: Rigorous Mathematical Analysis,[Scott V. Burger],49.99,4.1
PYTHON FOR DATA SCIENCE: The Ultimate Beginners’ Guide to Learning Python Data Science Step Step,[Mr Ethan Williams],19.99,4.3
97 Things About Ethics Everyone in Data Science Should Know: Collective Wisdom from the Experts,[Bill Franks],30.99,4.1
Data Science for Marketing Analytics: A practical guide to forming a killer marketing strategy through data analysis with Python 2nd Edition,"[Mirza Rahim Baig,Gururajan Govindan et al.]",36.99,4.6
Video Data Analysis: How to Use 21st Century Video in the Social Sciences,"[Anne Nassauer,Nicolas M. Legewie]",45,5
The Beginners Guide to Data Science,"[Robert Ball,Brian Rague]",69.99,
Hands-On Data Science with R: Techniques to perform data manipulation and mining to build smart analytical models using R,"[Vitor Bianchi Lanzetta,Nataraj Dasgupta et al.]",39.99,4.1
The Data Science Handbook: Advice and Insights from 25 Amazing Data Scientists,"[Carl Shan,William Chen et al.]",24.99,4.4
Machine Learning and Data Science Blueprints for Finance: From Building Trading Strategies to Robo-Advisors Using Python,"[Hariom Tatsat,Sahil Puri et al.]",44.49,4.3
Practical Python Data Wrangling and Data Quality: Getting Started with Reading Cleaning and Analyzing Data,[Susan McGregor],31.99,3.5
Cracking the Data Science Interview: 101+ Data Science Questions & Solutions,[Maverick Lin],11.99,3.7
SQL for Data Scientists: A Beginners Guide for Building Datasets for Analysis,[Renee M. P. Teate],32.49,4.7
MLOps Engineering at Scale,[Carl Osipov],44.49,4.2
The Data Science Design Manual (Texts in Computer Science),,52.05,4.8
Big Data: A Very Short Introduction (Very Short Introductions),[Dawn E. Holmes],11.07,4.4
SQL for Data Analysis: Advanced Techniques for Transforming Data into Insights,[Cathy Tanimura],40.49,4.7
The Cyberwarrior Handbook: A Beginners Guide to Hacking from Recon to Exploitation,[OccupyTheWeb],49.99,
Comet for Data Science: Enhance your ability to manage and optimize the life cycle of your data science project,"[Angelica Lo Duca,Gideon Mendels]",44.99,5
Optimization for Data Analysis,"[Stephen J. Wright,Benjamin Recht]",38.91,5
The Self-Taught Computer Scientist: The Beginners Guide to Data Structures & Algorithms,[Cory Althoff],19.49,4.5
Quantitative Social Science: An Introduction in tidyverse,"[Kosuke Imai,Nora Webb Williams]",49.99,3.8
Data Science Interview: Prep for SQL Panda Python R Language Machine Learning DBMS and RDBMS – And More – The Full Data Scientist Interview Handbook,[DSI ACE PREP],24.99,4.7
The Data Vault Guru: a pragmatic guide on building a data vault,[Mr Patrick Cuba],76.96,4.1
Responsible Data Science,"[Grant Fleming,Peter C. Bruce]",19.86,3.8
Fundamentals of Data Science with MATLAB: Introduction to Scientific Computing Data Analysis and Data Visualization,[Arash Karimpour],26,4.5
Python for Data Science: Clear and Complete Guide to Data Science and Analysis with Python,[Alex Campbell],14.95,3.9
Learn Power BI: A comprehensive step--step guide for beginners to learn real-world business intelligence 2nd Edition,[Greg Deckler],44.64,4.4
Data Visualization with Excel Dashboards and Reports,[Dick Kusleika],22.99,4.4
Data Science For Dummies 2nd Edition,"[Lillian Pierson,Jake Porway]",41.02,4.4
Hands-On Data Structures and Algorithms with Python: Store manipulate and access data effectively and boost the performance of your applications 3rd Edition,[Dr. Basant Agarwal],44.99,4.6
Business Intelligence Analytics and Data Science: A Managerial Perspective,"[Ramesh Sharda,Dursun Delen et al.]",106.66,4.5
Guide to Data Science: Brief Introduction to the Quirky World of Data,[Aryan Goyal],14.99,5
Machine Learning for Time Series Forecasting with Python,[Francesca Lazzeri],32.49,3.9
Introduction to Computation: Haskell Logic and Automata (Undergraduate Topics in Computer Science),,33.9,5
Data Science: Concepts and Practice,"[Vijay Kotu,Bala Deshpande]",69.34,4.5
Inferential Network Analysis (Analytical Methods for Social Research),,54.81,4.7
Data Science In The Library: Tools and Strategies for Supporting Data-Driven Research and Instruction,[Joel Herndon],80.31,
Foundational Python for Data Science (Addison-Wesley Data & Analytics Series),,39.99,4.3
Integrating Data,"[Bill Inmon,Patty Haines et al.]",39.95,5
Bioinformatics Data Skills: Reproducible and Robust Research with Open Source Tools,[Vince Buffalo],45.77,4.6
Python Crash Course 2nd Edition: A Hands-On Project-Based Introduction to Programming,[Eric Matthes],21.49,4.7
The Esri Guide to GIS Analysis Volume 3: Modeling Suitability Movement and Interaction (The ESRI Guide to GIS Analysis 3),[Andy Mitchell],33.93,4.4
The Applied SQL Data Analytics Workshop: Develop your practical skills and prepare to become a professional data analyst 2nd Edition,"[Matt Goldwasser,Upom Malik et al.]",34.99,4.6
Data Mesh: Delivering Data-Driven Value at Scale,[Zhamak Dehghani],51.89,4.5
End-to-End Data Science with SAS®: A Hands-On Programming Guide,[James Gearheart],39.95,4.5
An Introduction to Data Science,"[Jeffrey S. Saltz,Jeffrey M. Stanton]",44.86,4.4
Probabilistic Machine Learning: An Introduction (Adaptive Computation and Machine Learning series),,99,4.4
Computer Science Unleashed: Harness the Power of Computational Systems,,29.95,4.9
R Statistics Cookbook: Over 100 recipes for performing complex statistical operations with R 3.5,[Francisco Juretig],24.99,4.6
Introduction to Statistics: An Intuitive Guide for Analyzing Data and Unlocking Discoveries,[Jim Frost],18.91,4.5
Algorithms and Data Structures for Massive Datasets,"[Dzejla Medjedovic,Emin Tahirovic et al.]",59.99,3.8
Data Science (Chapman & Hall/CRC Data Science Series),"[Tiffany Timbers,Trevor Campbell et al.]",59.95,
Data Democratization with Domo: Bring together every component of your business to make better data-driven decisions using Domo,[Jeff Burtenshaw],49.99,4.8
Determann’s Field Guide to Data Privacy Law: International Corporate Compliance (Elgar Compliance Guides),[Lothar Determann],73.08,
Data Visualization with Python for Beginners: Visualize Your Data using Pandas Matplotlib and Seaborn (Machine Learning & Data Science for Beginners),,19.99,4.1
Practical Synthetic Data Generation: Balancing Privacy and the Broad Availability of Data,"[Khaled El Emam,Lucy Mosquera et al.]",28.49,4.1
Data Analysis in Sports Science,"[Gabriel J. Sanders PhD,Corey A. Peacock PhD]",59.99,4.7
Python for Geospatial Data Analysis: Theory Tools and Practice for Location Intelligence,[Bonny McClain],66.49,
Data Science for Librarians (Library and Information Science Text Series),,65,5
Basketball Data Science: With Applications in R (Chapman & Hall/CRC Data Science Series),,43.35,4.1
Data Analytics for Absolute Beginners: A Deconstructed Guide to Data Literacy: (Introduction to Data Data Visualization Business Intelligence & ... Science Python & Statistics for Beginners),,14.9,4.4
Bayesian Data Analysis (Chapman & Hall/CRC Texts in Statistical Science),,78.22,4.7
Murachs Python for Data Analysis (Training & Reference),[Scott Mccoy],58.33,4.6
Cracking the Coding Interview: 189 Programming Questions and Solutions,[Gayle Laakmann McDowell],35.95,4.7
Docker for Data Science: Building Scalable and Extensible Data Infrastructure Around the Jupyter Notebook Server,[Joshua Cook],49.49,3.7
Mastering PostgreSQL 13: Build administer and maintain database applications efficiently with PostgreSQL 13 4th Edition,[Hans-Jurgen Schonig],41.99,4.2
Data Analysis with Python and PySpark,[Jonathan Rioux],48,4.8
PYTHON: Learn Coding Programs with Python Programming and Master Data Analysis & Analytics Data Science and Machine Learning with the Complete Crash Course for Beginners - 5 Manuscripts in 1 Book,[TechExp Academy],24.9,4.2
DATA SCIENCE WITH PYTHON: Complete Guide To Understanding Data Analytics And Data Science With Python Programming (Code tutorials),[Craig Berg],9.98,
Data Analytics: Practical Guide to Leveraging the Power of Algorithms Data Science Data Mining Statistics Big Data and Predictive Analysis to Improve Business Work and Life,[Arthur Zhang],11.97,3.7
Introduction to Machine Learning,[Etienne Bernard],29.6,4.4
Hands-On Data Structures and Algorithms with Kotlin: Level up your programming skills understanding how Kotlins data structure works,"[Chandra Sekhar Nayak,Rivu Chakraborty]",36.99,3.6
Asking Smarter Questions: How To Be an Agent of Insight (Using Data Better),[Sam Knowles],39.95,
Scalable Data Analytics with Azure Data Explorer: Modern ways to query analyze and perform real-time data analysis on large volumes of data,"[Jason Myerscough,Arunee Singhchawla]",51.99,5
The Political Philosophy of AI: An Introduction,[Mark Coeckelbergh],19.59,3.7
Transformers for Machine Learning: A Deep Dive (Chapman & Hall/CRC Machine Learning & Pattern Recognition),"[Uday Kamath,Kenneth Graham et al.]",54.95,3.9
Predictive Analytics: Data Mining Machine Learning and Data Science for Practitioners (Pearson Business Analytics Series),[Dursun Delen],47.49,4.1
Pre-K-12 Guidelines for Assessment and Instruction in Statistics Education II (GAISE II): A Framework for Statistics and Data Science Education,"[Anna Bargagliotti,Christine Franklin et al.]",15,5
Confident Data Skills: How to Work with Data and Futureproof Your Career (Confident Series),,14.64,4.7
Learning Tableau 2022,"[Joshua N. Milligan,Blair Hutchinson et al.]",55.09,5
The Data Warehouse Toolkit: The Definitive Guide to Dimensional Modeling 3rd Edition,,40.16,4.7
Data Science in Education Using R,"[Ryan A. Estrellado,Jesse Mostipak et al.]",48.95,4.6
Data Mining with Rattle and R: The Art of Excavating Data for Knowledge Discovery (Use R!),,84.99,4.3
Statistics for Beginners in Data Science: Theory and Applications of Essential Statistics Concepts using Python (Machine Learning & Data Science for Beginners),,17.99,4.3
Detecting Regime Change in Computational Finance: Data Science Machine Learning and Algorithmic Trading,"[Jun Chen,Edward P K Tsang]",54.95,
Massive Graph Analytics (Chapman & Hall/CRC Data Science Series),,150,
Practical Data Science with R,"[Nina Zumel,John Mount]",35.74,4.5
Neo4j Graph Data Science Certified: Exam Practice Tests,[Cristian Scutaru],14.99,4.5
Grokking Machine Learning,[Luis Serrano],47.99,4.6
Data Science for Immunologists,"[Niclas Thomas,Laura Pallett]",28.06,4.7
Data Science Analytics and Machine Learning with R,"[Luiz Paulo Favero,Patricia Belfiore et al.]",150,
The TensorFlow Workshop: A hands-on guide to building deep learning models from scratch using real-world datasets,"[Matthew Moocarme,Anthony So et al.]",41.99,4.3
Data Action: Using Data for Public Good,[Sarah Williams],33.69,4.7
Data Governance For Dummies,[Jonathan Reichental],34.99,
A Criminologists Guide to R: Crime the Numbers (Chapman & Hall/CRC The R Series),[Jacob Kaplan],79.96,
Marketing Analytics: A Practical Guide to Improving Consumer Insights Using Data Techniques,[Mike Grigs],35.99,4.4
Applied Data Science: Lessons Learned for the Data-Driven Business,"[Martin Braschler,Thilo Stadelmann et al.]",179.99,1
The Pandas Workshop: A comprehensive guide to using Python for data analysis with real-world case studies,"[Blaine Bateman,Saikat Basak et al.]",47.49,4.6
Data Modeling for Azure Data Services: Implement professional data design and structures in Azure,[Peter ter Braake],51.99,4.6
SQL for Data Analytics: Perform fast and efficient data analysis with the power of SQL,"[Upom Malik,Matt Goldwasser et al.]",27.89,4.4
Ethics of Data and Analytics: Concepts and Cases,[Kirsten Martin],69.95,
Introduction to Computation and Programming Using Python: With Application to Understanding Data (The MIT Press),[John V. Guttag],42.75,4.6
SQL: 3 books 1 - The Ultimate Beginner Intermediate & Expert Guides To Master SQL Programming Quickly with Practical Exercises,[Mark Reed],24.29,4.9
Machine Learning Bookcamp: Build a portfolio of real-life projects,[Alexey Grigorev],35.99,5
The Data Model Resource Book Vol. 2: A Library of Data Models for Specific Industries,"[Len Silverston,John A. Zachman]",61.82,4
Essential PySpark for Scalable Data Analytics: A beginners guide to harnessing the power and ease of PySpark 3,[Sreeram Nudurupati],46.99,4.5
Cloud Scale Analytics with Azure Data Services: Build modern data warehouses on Microsoft Azure,[Patrik Borosch],54.99,4.8
Can We Trust AI? (Johns Hopkins Wavelengths),"[Rama Chellappa,Eric Niiler]",16.95,
Data Engineering with Python: Work with massive datasets to design data models and automate data pipelines using Python,[Paul Crickard],37.79,4.2
Mastering Tableau 2021: Implement advanced business intelligence techniques and analytics with Tableau 3rd Edition,"[Marleen Meier,David Baldwin et al.]",46.99,4.4
Geographical Data Science and Spatial Data Analysis: An Introduction in R (Spatial Analytics and GIS),,51,4.5
Malware Data Science: Attack Detection and Attribution,"[Joshua Saxe,Hillary Sanders]",37.03,4.6
Learning Geospatial Analysis with Python: Understand GIS fundamentals and perform remote sensing data analysis using Python 3.7 3rd Edition,[Joel Lawhead],49.99,4.4
The Big Book of Dashboards: Visualizing Your Data Using Real-World Business Scenarios,"[Steve Wexler,Jeffrey Shaffer et al.]",24.49,4.6
Machine Learning with R: Expert techniques for predictive modeling 3rd Edition,[Brett Lantz],37.99,4.6
Hands-on Programmatic In-house Digital Advertising: Learn Data Design AI Implementation Bidding Strategies and Strategic Thinking (English Edition),[Raghavendra Agarwala],29.95,3.5
Ontology-Based Information Retrieval for Healthcare Systems,[Vishal Jain],197.02,
Data Governance: How to Design Deploy and Sustain an Effective Data Governance Program (The Morgan Kaufmann Series on Business Intelligence),,39.17,4.3
Data Science in Context: Foundations Challenges Opportunities,"[Alfred Z. Spector,Peter Norvig et al.]",39.99,
Python Machine Learning: Machine Learning and Deep Learning with Python scikit-learn and TensorFlow 2 3rd Edition,"[Sebastian Raschka,Vahid Mirjalili]",49.39,4.5
Machine Learning in Biotechnology and Life Sciences: Build machine learning models using Python and deploy them on the cloud,[Saleh Alkhalifa],49.99,4.1
Data Science and Big Data Analytics: Discovering Analyzing Visualizing and Presenting Data,[EMC Education Services],41.76,4.4
Fundamentals of Data Science Part I: Inference and Experiment,[Jared M Maruskin],22.63,5
Graph Neural Networks: Foundations Frontiers and Applications,"[Lingfei Wu,Peng Cui et al.]",85.38,4.6
Data-Driven Evolutionary Optimization: Integrating Evolutionary Computation Machine Learning and Data Science (Studies in Computational Intelligence 975),,169.99,5
Getting Started with Elastic Stack 8.0: Run powerful and scalable data platforms to search observe and secure your organization,"[Asjad Athick,Shay Banon]",49.99,4.7
Functional Aesthetics for Data Visualization,"[Vidya Setlur,Bridget Cogley]",40,
R Programming for Data Science,[Roger Peng],25,4.2
Building Data Science Solutions with Anaconda: A comprehensive starter guide to building robust and complete models,"[Dan Meador,Kevin Goldsmith]",44.99,5
Data Lakehouse in Action: Architecting a modern and scalable data analytics platform,[Pradeep Menon],39.99,4.3
Fundamentals of Data Science Part III: Machine Learning,[Jared M Maruskin],29.95,
Machine Learning and Big Data Analytics Paradigms: Analysis Applications and Challenges (Studies in Big Data 77),,13.32,
Data Analysis in Qualitative Research: Theorizing with Abductive Analysis,"[Stefan Timmermans,Iddo Tavory]",20,4.4
Mastering TensorFlow 2.x: Implement Powerful Neural Nets across Structured Unstructured datasets and Time Series Data (English Edition),[Rajdeep Dua],29.95,5
The Tableau Workshop: A practical guide to the art of data visualization with Tableau,"[Sumit Gupta,Sylvester Pinto et al.]",46.99,4.8
HBR Guide to Data Analytics Basics for Managers (HBR Guide Series),,14.19,4.5
The Hundred-Page Machine Learning Book,[Andriy Burkov],31.99,4.6
Oracle Database Administration Interview Questions Youll Most Likely Be Asked: Interview Questions Youll Most Likely Be Asked (Job Interview Questions Series),[Vibrant Publishers],23.99,4.2
Hypothesis Testing: An Intuitive Guide for Making Data Driven Decisions,[Jim Frost],23.74,4.6
Game Data Science,"[Magy Seif El-Nasr,Truong-Huy D. Nguyen et al.]",73.09,5
The Data Model Resource Book Vol. 3: Universal Patterns for Data Modeling,"[Len Silverston,Paul Agnew]",51.31,4.4
Supervised Machine Learning for Text Analysis in R (Chapman & Hall/CRC Data Science Series),,46.02,4.5
Combining DataOps MLOps and DevOps: Outperform Analytics and Software Development with Expert Practices on Process Optimization and Automation (English Edition),"[Dr. Kalpesh Parikh,Amit Johri]",29.95,3
Categorical Data Analysis for the Behavioral and Social Sciences,"[Razia Azen,Cindy M. Walker]",87.94,
Big Data and Artificial Intelligence: Complete Guide to Data Science AI Big Data and Machine Learning.,[Hans Weber],24.95,4.1
Hands-On Healthcare Data: Taming the Complexity of Real-World Data,[Andrew Nguyen],75.99,
Python Data Cleaning Cookbook: Modern techniques and Python tools to detect and remove dirty data and extract key insights,[Michael Walker],37.13,4.8
DATA SCIENCE: Simple and Effective Tips and Tricks to Learn Data Science,[Benjamin Smith],15.39,3.9
Natural Language Processing with Transformers: Building Language Applications with Hugging Face,"[Lewis Tunstall,Leandro von Werra et al.]",43.09,4.6
Data Mining for Business Analytics: Concepts Techniques and Applications in Python,"[Galit Shmueli,Peter C. Bruce et al.]",108.99,4.5
Quantitative Social Science Data with R: An Introduction,[Brian J Fogarty],51,4.9
Mathematics for Machine Learning,,46.54,4.7
Machine Learning for Time-Series with Python: Forecast predict and detect anomalies with state-of-the-art machine learning methods,[Ben Auffarth],49.39,4
Statistics for Health Data Science: An Organic Approach (Springer Texts in Statistics),,76.54,4.6
Python for Data Analysis: Data Wrangling with Pandas NumPy and IPython,[William McKinney],53.99,4.6
Python Data Analysis: Perform data collection data processing wrangling visualization and model building using Python 3rd Edition,"[Avinash Navlani,Armando Fandango et al.]",34.99,4.7
