title,author,price,avg_reviews
Artificial Intelligence with Python Cookbook: Proven recipes for applying AI algorithms and deep learning techniques using TensorFlow 2.x and PyTorch 1.6,[Ben Auffarth],39.99,4.5
Hands-On Image Generation with TensorFlow: A practical guide to generating images and videos using deep learning,[Soon Yau Cheong],40.59,4.8
Modern Deep Learning Design and Application Development: Versatile Tools to Solve Deep Learning Problems,[Andre Ye],49.44,5
Deep Learning with Keras: Implementing deep learning models and neural networks with the power of Python,"[Antonio Gulli,Sujit Pal]",51.99,3.5
Hands-On Genetic Algorithms with Python: Applying genetic algorithms to solve real-world deep learning and artificial intelligence problems,[Eyal Wirsansky],41.99,4.6
Engineering Deep Learning Systems,"[Chi Wang,Donald Szeto]",59.99,
Evolutionary Deep Learning: Genetic algorithms and neural networks,[Michael Lanham],59.99,
Transformers for Natural Language Processing: Build innovative deep neural network architectures for NLP with Python PyTorch TensorFlow BERT RoBERTa and more,[Denis Rothman],40.59,4.2
Introduction to Deep Learning for Healthcare,"[Cao Xiao,Jimeng Sun]",55.49,4.1
Deep Learning and Physics (Mathematical Physics Studies),,99.99,2
R Deep Learning Essentials: A step--step guide to building deep learning models using TensorFlow Keras and MXNet 2nd Edition,"[Mark Hodnett,Joshua F. Wiley]",41.99,4.1
Implement NLP use-cases using BERT: Explore the Implementation of NLP Tasks Using the Deep Learning Framework and Python (English Edition),[Amandeep],29.95,3
Machine Learning at Scale with H2O: A practical guide to building and deploying machine learning models on enterprise systems,"[Gregory Keys,David Whiting]",39.99,5
Python: The Complete Crash Course to Learn Python in One Week Machine Learning and Deep Learning with Hands-On Exercises,[frad willson],14.99,
Pro Deep Learning with TensorFlow: A Mathematical Approach to Advanced Artificial Intelligence in Python,[Santanu Pattanayak],69.99,4.1
ARTIFICIAL INTELLIGENCE WITH MATLAB. DEEP LEARNING ARCHITECTURES,[Perez],25.99,
GANs in Action: Deep learning with Generative Adversarial Networks,"[Jakub Langr,Vladimir Bok]",37.99,4.2
From Curiosity to Deep Learning: Personal Digital Inquiry in Grades K-5,"[Julie Coiro,Elizabeth Dobler et al.]",33.06,4.6
Deep Learning Applications of Short-range Radars,"[Avik Santra,Souvik Hazra]",179,5
Deep Learning Cookbook: Practical Recipes to Get Started Quickly,[Douwe Osinga],37.3,4.5
Deep Reinforcement Learning with Python: With PyTorch TensorFlow and OpenAI Gym,[Nimish Sanghi],36.49,4.3
Empowering Young Children,[Wendy Ostroff],34.95,
Deep Discourse: A Framework for Cultivating Student-Led Discussions -Use Conversation to Raise Student Learning Motivation and Engagement in K-12 Classrooms,"[Sandi Novak,Cara Slattery]",36.95,5
Purposeful Play: A Teachers Guide to Igniting Deep and Joyful Learning Across the Day,"[Kristine Mraz,Alison Porcelli et al.]",28.34,4.7
Generative AI with Python and TensorFlow 2: Create images text and music with VAEs GANs LSTMs Transformer models,"[Joseph Babcock,Raghav Bali]",37.99,4.3
DEEP LEARNING TOOLS: NEURAL NETWORKS USING MATLAB,[Perez],25.99,
Embedded Deep Learning: Algorithms Architectures and Circuits for Always-on Neural Network Processing,"[Bert Moons,Daniel Bankman et al.]",88.12,5
Learning Unix for OS X: Going Deep With the Terminal and Shell,[Dave Taylor],24.99,4.4
Hands-On Natural Language Processing with PyTorch 1.x: Build smart AI-driven linguistic applications using deep learning and NLP techniques,[Thomas Dop],41.99,3.7
Python Deep Learning Projects: 9 projects demystifying neural network and deep learning models for building intelligent systems,"[Matthew Lamons,Rahul Kumar et al.]",46.99,3.9
Deep Learning Pipeline: Building a Deep Learning Model with TensorFlow,"[Hisham El-Amir,Mahmoud Hamdy]",15.43,2
Machine Learning for Cybersecurity: Innovative Deep Learning Solutions (SpringerBriefs in Computer Science),[Marwan Omar],54.99,
Beginning Deep Learning with TensorFlow: Work with Keras MNIST Data Sets and Advanced Neural Networks,"[Liangqu Long,Xiangming Zeng]",28.98,
Cultivating Curiosity in K-12 Classrooms: How to Promote and Sustain Deep Learning,[Wendy L. Ostroff],21.9,4.5
Machine Learning for Economics and Finance in TensorFlow 2: Deep Learning Models for Research and Industry,[Isaiah Hull],48.04,3.3
Machine Learning for Algorithmic Trading: Predictive models to extract signals from market and alternative data for systematic trading strategies with Python 2nd Edition,[Stefan Jansen],44.99,4.5
The Deep Learning AI Playbook: Strategy for Disruptive Artificial Intelligence,[Carlos E Perez],29,3.7
Risk Modeling: Practical Applications of Artificial Intelligence Machine Learning and Deep Learning (Wiley and SAS Business Series),"[Terisa Roberts,Stephen J. Tonna]",47.92,
AI and Machine Learning for Coders: A Programmers Guide to Artificial Intelligence,[Laurence Moroney],38.49,4.7
Building Computer Vision Projects with OpenCV 4 and C++: Implement complex computer vision algorithms and explore deep learning and face detection,"[David Millan Escriva,Prateek Joshi et al.]",49.99,4.1
Advanced Deep Learning with TensorFlow 2 and Keras: Apply DL GANs VAEs deep RL unsupervised learning object detection and segmentation and more 2nd Edition,[Rowel Atienza],39.99,4.5
Deep Learning for Computer Vision with SAS®: An Introduction,[Robert Blanchard],25.95,
Understanding Deep Learning: Application in Rare Event Prediction (Student Version),[Chitta Ranjan Ph.D.],30,
Deep Learning on Graphs,"[Yao Ma,Jiliang Tang]",45.91,4.7
Data Orchestration in Deep Learning Accelerators (Synthesis Lectures on Computer Architecture),"[Tushar Krishna,Hyoukjun Kwon et al.]",73.76,4.2
Deep Reinforcement Learning,[Aske Plaat],58.31,
Efficient Processing of Deep Neural Networks (Synthesis Lectures on Computer Architecture),"[Vivienne Sze,Yu-Hsin Chen et al.]",86.35,4.5
Computer Vision: Algorithms and Applications (Texts in Computer Science),[Richard Szeliski],68.1,4.3
Applied Software Development With Python & Machine Learning Wearable & Wireless Systems For Movement Disorder Treatment Via Deep Brain Stimulation,"[Robert Lemoyne,Timothy Mastroianni]",79.23,
Data Scientist Pocket Guide: Over 600 Concepts Terminologies and Processes of Machine Learning and Deep Learning Assembled Together (English Edition),[Mohamed Sabri],29.95,4.7
Deep Learning with fastai Cookbook: Leverage the easy-to-use fastai framework to unlock the power of deep learning,[Mark Ryan],44.99,4.6
Learning TensorFlow: A Guide to Building Deep Learning Systems,"[Tom Hope,Yehezkel S. Resheff et al.]",35.75,3.9
Machine and Deep Learning in Oncology Medical Physics and Radiology,"[Issam El Naqa,Martin J. Murphy]",174.64,
Deep Learning for Physical Scientists: Accelerating Research with Machine Learning,"[Edward O. Pyzer-Knapp,Matthew Benatan]",69.1,5
Deep Learning and the Game of Go,"[Max Pumperla,Kevin Ferguson]",50.58,4.4
Automated Machine Learning with AutoKeras: Deep learning made accessible for everyone with just few lines of coding,[Luis Sobrecueva],41.99,4.7
Deep Learning with TensorFlow: Explore neural networks and build intelligent systems with Python 2nd Edition,"[Giancarlo Zaccone,Md. Rezaul Karim]",36.11,3.2
Advances in Electromagnetics Empowered Artificial Intelligence and Deep Learning (IEEE Press Series on Electromagnetic Wave Theory),"[Sawyer D. Campbell,Douglas H. Werner]",165,
Practical MATLAB Deep Learning: A Projects-Based Approach,"[Michael Paluszek,Stephanie Thomas et al.]",38.34,
AI Crash Course: A fun and hands-on introduction to machine learning reinforcement learning deep learning and artificial intelligence with Python,[Hadelin de Ponteves],29.99,4.2
Deep Learning In Biology And Medicine,"[Davide Bacciu,Paulo J G Lisboa et al.]",97.65,
Autonomous Robotics and Deep Learning (SpringerBriefs in Computer Science),,69.99,5
Hands-On Music Generation with Magenta: Explore the role of deep learning in music generation and assisted music composition,[Alexandre DuBreuil],41.99,4.5
Artificial Intelligence Machine Learning and Deep Learning,[Oswald Campesato],59.95,4.4
Culture in School Learning: Revealing the Deep Meaning,[Etta R. Hollins],48.81,4.4
Practical MATLAB Deep Learning: A Project-Based Approach,"[Michael Paluszek,Stephanie Thomas]",20.49,3.7
Graph-Powered Machine Learning,[Alessandro Nego],42.99,4.4
Mastering Computer Vision with TensorFlow 2.x: Build advanced computer vision applications using machine learning and deep learning techniques,[Krishnendu Kar],44.99,3.9
DEEP LEARNING WITH PYTHON: 3 in 1- Beginners Guide+ Simple and Effective Tips and Tricks+ Advanced Guide to Learn Deep Learning with Python,[Benjamin Smith],49.99,3.5
Practical Machine Learning with H2O: Powerful Scalable Techniques for Deep Learning and AI,[Darren Cook],33.09,4.2
Deep Learning Approaches for Security Threats in IoT Environments,"[Mohamed Abdel-Basset,Nour Moustafa et al.]",140,
Artificial Intelligence and Deep Learning in Pathology,[Stanley Cohen MD],82.3,4.1
Grokking Artificial Intelligence Algorithms: Understand and apply the core algorithms of deep learning and artificial intelligence in this friendly illustrated guide including exercises and examples,[Rishal Hurbans],55.95,4.5
Codeless Deep Learning with KNIME: Build train and deploy various deep neural network architectures using KNIME Analytics Platform,"[Kathrin Melcher,Rosaria Silipo]",49.99,4.4
Deep Learning Applications (Advances in Intelligent Systems and Computing 1098),,104.51,
Deep Learning with Python: Learn Best Practices of Deep Learning Models with PyTorch,"[Nikhil Ketkar,Jojo Moolayil]",32.99,4
Artificial Intelligence in Healthcare: AI Machine Learning and Deep and Intelligent Medicine Simplified for Everyone,[Dr Parag Suresh Mahajan MD],29.99,4.7
Getting started with Deep Learning for Natural Language Processing: Learn how to build NLP applications with Deep Learning (English Edition),[Sunil Patel],29.95,4.6
Neural Networks and Deep Learning: A Textbook,[Charu C. Aggarwal],49,4.5
Deep Learning with PyTorch: A practical approach to building neural network models using PyTorch,[Vishnu Subramanian],31.75,3.5
Machine Learning with Python Cookbook: Practical Solutions from Preprocessing to Deep Learning,,45.39,4.5
Deep Learning with R Second Edition,"[Francois Chollet,Tomasz Kalinowski et al.]",59.99,4.6
Designing Machine Learning Systems: An Iterative Process for Production-Ready Applications,[Chip Huyen],43.49,4.7
Deep Learning for the Earth Sciences: A Comprehensive Approach to Remote Sensing Climate Science and Geosciences,"[Gustau Camps-Valls,Devis Tuia et al.]",106.99,5
Math and Architectures of Deep Learning,[Krishnendu Chaudhury],49.99,
Programming Machine Learning: From Coding to Deep Learning,[Paolo Perrotta],33.49,4.8
Beginning Anomaly Detection Using Python-Based Deep Learning: With Keras and PyTorch,"[Sridhar Alla,Suman Kalyan Adari]",25.49,4.3
Deep Reinforcement Learning: Fundamentals Research and Applications,"[Hao Dong,Zihan Ding et al.]",137.42,4.5
Deep Learning for Personalised Healthcare Services (Issn 7),"[Jain,Vishal et al.]",103.29,
Deep Learning in a Disorienting World,[Jon F. Wergin],35.99,5
Artificial Intelligence Engines: A Tutorial Introduction to the Mathematics of Deep Learning,[James V Stone],23.99,4.3
Hands-On Machine Learning with C++: Build train and deploy end-to-end machine learning and deep learning pipelines,[Kirill Kolodiazhnyi],49.99,4.3
Machine Learning Design Patterns: Solutions to Common Challenges in Data Preparation Model Building and MLOps,"[Valliappa Lakshmanan,Sara Robinson et al.]",36.99,4.6
Deep Learning with Hadoop,[Dipayan Dev],41.99,4.7
Hands-On Mathematics for Deep Learning: Build a solid mathematical foundation for training efficient deep neural networks,[Jay Dawani],39.99,4
Mastering OpenCV 4 with Python: A practical guide covering topics from image processing augmented reality to deep learning with OpenCV 4 and Python 3.7,[Alberto Fernandez Villan],44.99,4
Deep Learning with PyTorch Lightning: Swiftly build high-performance Artificial Intelligence (AI) models using Python,[Kunal Sawarkar],44.64,4.8
Advanced Deep Learning with Python: Design and implement advanced next-generation AI solutions using TensorFlow and PyTorch,[Ivan Vasilev],44.99,4.6
Differentiation and the Brain: How Neuroscience Supports the Learner-Friendly Classroom (Use Brain-Based Learning and Neuroeducation to Differentiate Instruction),"[David A. Sousa,Carol Ann Tomlinson]",31.38,4.7
Programming PyTorch for Deep Learning: Creating and Deploying Deep Learning Applications,[Ian Pointer],34.49,4.1
MATLAB Deep Learning: With Machine Learning Neural Networks and Artificial Intelligence,[Phil Kim],37.09,4.2
Deep Learning for Radar and Communications Automatic Target Recognition,"[Uttam K. Majumder,Erik P. Blasch et al.]",179,
Deep Learning: A Practitioners Approach,"[Josh Patterson,Adam Gibson]",23.49,4.2
Synthetic Data for Deep Learning (Springer Optimization and Its Applications 174),,169.99,3.5
Deep Reinforcement Learning with Python: Master classic RL deep RL distributional RL inverse RL and more with OpenAI Gym and TensorFlow 2nd Edition,[Sudharsan Ravichandiran],39.99,4.4
Python Machine Learning - Second Edition: Machine Learning and Deep Learning with Python scikit-learn and TensorFlow,"[Sebastian Raschka,Vahid Mirjalili]",41.99,4.5
Essentials of Deep Learning and AI: Experience Unsupervised Learning Autoencoders Feature Engineering and Time Series Analysis with TensorFlow Keras and scikit-learn (English Edition),"[Shashidhar Soppin,Dr. Manjunath Ramachandra et al.]",29.95,5
Hands-On Deep Learning with Apache Spark: Build and deploy distributed deep learning applications on Apache Spark,[Guglielmo Iozzia],46.99,4
Deep Learning from the Basics: Python and Deep Learning: Theory and Implementation,[Koki Saitoh],39.99,4.3
Introduction to Machine Learning with Python: A Guide for Data Scientists,,45,4.5
Machine Learning Engineering,[Andriy Burkov],39.49,4.7
Feature Store for Machine Learning: Curate discover share and serve ML features at scale,[Jayanth Kumar M J],39.99,5
Machine Learning Fundamentals,[Hui Jiang],47.49,4.3
Applied Machine Learning Explainability Techniques: Make ML models explainable and trustworthy for practical applications using LIME SHAP and more,[Aditya Bhattacharya],44.99,5
Machine Learning in the Oil and Gas Industry: Including Geosciences Reservoir Engineering and Production Engineering with Python,"[Yogendra Narayan Pandey,Ayush Rastogi et al.]",26.99,4.9
Machine Learning For Dummies,[John Paul Mueller],20.49,4.2
Journey to Become a Google Cloud Machine Learning Engineer: Build the mind and hand of a Google Certified ML professional,[Dr. Logan Song],42.74,
Advances in Financial Machine Learning,[Marcos Lopez de Prado],40.49,4.5
Machine Learning: A Probabilistic Perspective (Adaptive Computation and Machine Learning series),,96.46,4.4
Machine Learning: A Constraint-Based Approach,"[Marco Gori,Alessandro Betti et al.]",105,
AWS Certified Machine Learning Specialty: MLS-C01 Certification Guide: The definitive guide to passing the MLS-C01 exam on the very first attempt,"[Somanath Nanda,Weslley Moura]",49.99,4.2
Pattern Recognition and Machine Learning (Information Science and Statistics),[Christopher M. Bishop],76.1,4.6
Fundamentals of Machine Learning for Predictive Data Analytics second edition: Algorithms Worked Examples and Case Studies,"[John D. Kelleher,Brian Mac Namee et al.]",80,4.8
Machine Learning for Asset Managers (Elements in Quantitative Finance),,20,4.5
Human-in-the-Loop Machine Learning: Active learning and annotation for human-centered AI,[Robert (Munro) Monarch],42.49,4.4
Interpretable Machine Learning with Python: Learn to build interpretable high-performance models with hands-on real-world examples,[Serg Masís],40.41,4.6
Machine Learning for Streaming Data with Python: Rapidly build practical online machine learning solutions using River and other top key frameworks,[Joos Korstanje],44.99,5
Machine Learning Engineering in Action,[Ben Wilson],52.24,5
Gaussian Processes for Machine Learning (Adaptive Computation and Machine Learning series),"[Carl Edward Rasmussen,Christopher K. I. Williams]",50,4.7
Understanding Machine Learning: From Theory to Algorithms,"[Shai Shalev-Shwartz,Shai Ben-David]",62.99,4.4
Machine Learning in Finance: From Theory to Practice,"[Matthew F. Dixon,Igor Halperin et al.]",83.8,4.5
Machine Learning with Amazon SageMaker Cookbook: 80 proven recipes for data scientists and developers to perform machine learning experiments and deployments,[Joshua Arvin Lat],51.99,4.9
Introduction to Statistical and Machine Learning Methods for Data Science,"[Dr. Carlos Andre Reis Andre Reis Pinheiro,Mike Patetta]",29.95,5
Probabilistic Numerics: Computation as Machine Learning,"[Philipp Hennig,Michael A. Osborne et al.]",62.99,
Knowledge Graphs: Fundamentals Techniques and Applications (Adaptive Computation and Machine Learning series),,52.25,4.3
Scaling Machine Learning with Spark: Distributed ML with MLlib TensorFlow and PyTorch,[Adi Polak],64.31,
Building Machine Learning Pipelines: Automating Model Life Cycles with TensorFlow,"[Hannes Hapke,Catherine Nelson]",35.49,4.5
Hey Cyba,[Steve Young],22.3,4.3
Python Programming for Beginners: The #1 Python Programming Crash Course for Beginners to Learn Python Coding Well & Fast (with Hands-On Exercises),[Codeone Publishing],19.45,4.3
Machine Learning: A Bayesian and Optimization Perspective,[Sergios Theodoridis],74.42,4.6
Machine Learning: A Quantitative Approach,[Henry H Liu],49.99,4.8
Machine Learning for Text,[Charu C. Aggarwal],75.9,
Machine Learning revised and updated edition (The MIT Press Essential Knowledge series),,15.95,4.1
Machine Learning Guide for Oil and Gas Using Python: A Step--Step Breakdown with Data Algorithms Codes and Applications,"[Hoss Belyadi,Alireza Haghighat]",115.78,5
Automated Machine Learning for Business,"[Kai R. Larsen,Daniel S. Becker]",45,5
Data Mining: Concepts and Techniques (The Morgan Kaufmann Series in Data Management Systems),,71.2,4.3
Natural Language Processing with Transformers Revised Edition,"[Lewis Tunstall,Leandro von Werra et al.]",45.29,4.1
Mastering Azure Machine Learning: Execute large-scale end-to-end machine learning with Azure 2nd Edition,"[Christoph Korner,Marcel Alsdorf]",44.99,5
Getting Started with Natural Language Processing,[Ekaterina Kochmar],39.99,
Build Your Own Programming Language: A programmers guide to designing compilers interpreters and DSLs for solving modern computing problems,[Clinton L. Jeffery],40.49,4.3
Introduction to Online Convex Optimization second edition (Adaptive Computation and Machine Learning series),,60,
Machine Learning in Asset Pricing (Princeton Lectures in Finance 1),,42.99,4.3
Data Cleaning and Exploration with Machine Learning: Get to grips with machine learning techniques to achieve sparkling-clean data quickly,[Michael Walker],49.99,5
Machine Learning Engineering on AWS: Building Scaling and Securing Machine Learning Systems and MLOps Pipelines in Production,[Joshua Arvin Lat],44.99,
Practical Machine Learning for Computer Vision: End-to-End Machine Learning for Images,"[Valliappa Lakshmanan,Martin Görner et al.]",52.99,4.1
Getting Started with Amazon SageMaker Studio: Learn to build end-to-end machine learning projects in the SageMaker machine learning IDE,[Michael Hsieh],41.99,4.8
Data Engineering with Google Cloud Platform: A practical guide to operationalizing scalable data analytics systems on GCP,[Adi Wijaya],49.99,4.6
AWS Certified Machine Learning Study Guide: Specialty (MLS-C01) Exam,"[Shreyas Subramanian,Stefan Natu]",35.49,4.9
Reinforcement Learning second edition: An Introduction (Adaptive Computation and Machine Learning series),,66.44,4.6
Envisioning Information,[Edward R. Tufte],42,4.6
Kubeflow for Machine Learning: From Lab to Production,"[Trevor Grant,Holden Karau et al.]",29.6,4.1
Tree-Based Methods for Statistical Learning in R: A Practical Introduction with Applications in R (Chapman & Hall/CRC Data Science Series),,86.32,
The Pragmatic Programmer: Your Journey To Mastery 20th Anniversary Edition (2nd Edition),"[David Thomas,Andrew Hunt]",30.26,4.8
Python Machine Learning Workbook for Beginners: 10 Machine Learning Projects Explained from Scratch,,19.99,4.6
Data Science and Machine Learning Interview Questions Using R: Crack the Data Scientist and Machine Learning Engineers Interviews with Ease (English Edition),[Vishwanathan Narayanan],19.95,4.3
Automated Machine Learning on AWS: Fast-track the development of your production-ready machine learning applications the AWS way,"[Trenton Potgieter,Jonathan Dahlberg]",44.99,4.8
Quantum Machine Learning with Python: Using Cirq from Google Research and IBM Qiskit,[Santanu Pattanayak],28.98,3.9
TensorFlow Machine Learning Projects: Build 13 real-world projects with advanced numerical computations using the Python ecosystem,"[Ankit Jain,Armando Fandango et al.]",36.99,4
Applied Machine Learning and AI for Engineers: Solve Business Problems That Cant Be Solved Algorithmically,[Jeff Prosise],64.36,
An Introduction to Machine Learning,[Miroslav Kubat],56.99,
Linear Algebra and Learning from Data,[Gilbert Strang],82.47,4.6
Feature Engineering for Machine Learning: Principles and Techniques for Data Scientists,"[Alice Zheng,Amanda Casari]",42.49,4.5
Fundamentals of Machine Learning for Predictive Data Analytics: Algorithms Worked Examples and Case Studies (The MIT Press),"[John D. Kelleher,Brian Mac Namee et al.]",59.94,4.6
Feature Engineering Bookcamp,[Sinan Ozdemir],49.99,
Build Your Own AI Investor: Third Edition (AI Investor Series),[Dr. Damon Lee],52.99,4.2
Text Data Mining,"[Chengqing Zong,Rui Xia et al.]",29.31,5
Mathematics for Machine Technology,"[John C. Peterson,Robert D. Smith]",125.99,4.6
Distributed Machine Learning Patterns,[Yuan Tang],59.99,
Machine Learning and Security: Protecting Systems with Data and Algorithms,"[Clarence Chio,David Freeman]",44.49,4.5
Machine Learning for Beginners: Learn to Build Machine Learning Systems Using Python (English Edition),[Harsh Bhasin],16.23,3.9
Python for Data Science: 2 Books in 1. A Practical Beginner’s Guide to learn Python Programming introducing into Data Analytics Machine learning Web Development with Hands-on Projects,[ERICK THOMPSON],24.99,3.5
The Machine Learning Workshop: Get ready to develop your own high-performance machine learning algorithms with scikit-learn 2nd Edition,[Hyatt Saleh],36.99,4.6
Bayesian Reasoning and Machine Learning,[David Barber],81.99,4.2
Bayesian Optimization,[Roman Garnett],44.99,
Introduction To Machine Learning In Quantitative Finance An (Advanced Textbooks In Mathematics),"[Hao Ni,Xin Dong et al.]",38.99,3.6
Data Mining and Machine Learning: Fundamental Concepts and Algorithms,"[Mohammed J. Zaki,Wagner Meira Jr]",55.24,4.7
Artificial Intelligence and Machine Learning for Business: A No-Nonsense Guide to Data Driven Technologies,[Steven Finlay],19.99,4.4
Practical Machine Learning with Spark: Uncover Apache Spark’s Scalable Performance with High-Quality Algorithms Across NLP Computer Vision and ML(English Edition),"[Gourav Gupta,Dr. Manish Gupta et al.]",29.95,
Machine Learning in Business: An Introduction to the World of Data Science,[John C Hull],39,4.9
A First Course in Machine Learning (Chapman & Hall/CRC Machine Learning & Pattern Recognition),"[Simon Rogers,Mark Girolami]",43.96,4.4
Statistics Data Mining and Machine Learning in Astronomy: A Practical Python Guide for the Analysis of Survey Data Updated Edition (Princeton Series in Modern Observational Astronomy 13),"[Željko Ivezić,Andrew J. Connolly et al.]",78.8,4.9
Google BigQuery: The Definitive Guide: Data Warehousing Analytics and Machine Learning at Scale,"[Valliappa Lakshmanan,Jordan Tigani]",29.99,4.5
Machine Learning: An Algorithmic Perspective (Chapman & Hall/CRC Machine Learning & Pattern Recognition),,78.96,4.2
SQL FOR BEGINNERS: THE FUNDAMENTAL LANGUAGE FOR DATA SCIENCE TO MASTERING DATABASES. AN ESSENTIAL GUIDE YOU CAN’T MISS TO LEARN SQL IN 7 DAYS OR LESS WITH HANDS-ON PROJECTS.,[ERICK THOMPSON],13.99,3.9
Introduction to Data Mining and Analytics,[Kris Jamsa],67.65,4.6
Machine Learning for Hackers: Case Studies and Algorithms to Get You Started,"[Drew Conway,John Myles White]",49.99,3.7
Automated Machine Learning in Action,"[Qingquan Song,Haifeng Jin et al.]",44.99,4.5
A Primer on Machine Learning in Subsurface Geosciences (SpringerBriefs in Petroleum Geoscience & Engineering),,72,5
Machine Learning Refined: Foundations Algorithms and Applications,"[Jeremy Watt,Reza Borhani et al.]",60.61,3.9
Programming for Data Science: 4 Books in 1. The Complete Beginners Guide you Can’t Miss to Master the Era of the Data Economy using Python Java SQL Coding,[ERICK THOMPSON],33.99,4
Hands-On Unsupervised Learning Using Python: How to Build Applied Machine Learning Solutions from Unlabeled Data,[Ankur A. Patel],35.5,4.1
Reliable Machine Learning: Applying SRE Principles to ML in Production,"[Cathy Chen,Niall Murphy et al.]",61.99,
Building Machine Learning Powered Applications: Going from Idea to Product,[Emmanuel Ameisen],36.74,4.4
Machine Learning,[Peter Flach],53.99,4.2
Exploring GPT-3: An unofficial first look at the general-purpose language processing API from OpenAI,"[Steve Tingiris,Bret Kinsella]",49.99,4.4
Math for Programmers: 3D graphics machine learning and simulations with Python,[Paul Orland],40.84,4.5
Hands-On Julia Programming: An Authoritative Guide to the Production-Ready Systems in Julia (English Edition),[Sambit Kumar Dash],29.95,3.3
Data Mining: Practical Machine Learning Tools and Techniques (Morgan Kaufmann Series in Data Management Systems),,51.57,4.2
Machine Learning for Financial Risk Management with Python: Algorithms for Modeling Risk,[Abdullah Karasan],49.99,3.8
