title,author,price,avg_reviews
System Design Interview – An insiders guide,[Alex Xu],37.99,4.6
Linear Algebra and Optimization for Machine Learning: A Textbook,[Charu C. Aggarwal],47.27,4.6
Data Algorithms with Spark: Recipes and Design Patterns for Scaling Up using PySpark,[Mahmoud Parsian],45.56,5
Graph Machine Learning: Take graph data to the next level applying machine learning techniques and algorithms,"[Claudio Stamile,Aldo Marzullo et al.]",46.99,4
Machine Learning Pocket Reference: Working with Structured Data in Python,[Matt Harrison],20.99,4.6
Distributed Machine Learning with Python: Accelerating model training and serving with distributed systems,[Guanhua Wang],46.99,4
Machine Learning Engineering with Python: Manage the production life cycle of machine learning models using MLOps with practical examples,[Andrew P. McMahon],39.99,4.5
Practical Robotics in C++: Build and Program Real Autonomous Robots Using Raspberry Pi (English Edition),[Lloyd Brombach],29.95,4.5
Python Programming: 3 Books in 1: The Complete Beginner’s Guide to Learning the Most Popular Programming Language,[Dylan Penny],23.99,4.1
Serverless Architectures on AWS Second Edition,"[Peter Sbarski,Yan Cui et al.]",34.99,4.3
Automated Machine Learning with Microsoft Azure: Build highly accurate and scalable end-to-end AI solutions with Azure AutoML,[Dennis Michael Sawyers],46.99,4.6
Machine Learning for Computer Scientists and Data Analysts: From an Applied Perspective,"[Setareh Rafatirad,Houman Homayoun et al.]",121,
Interpretable AI: Building explainable machine learning systems,[Ajay Thampi],59.99,4.5
Machine Learning with Dynamics 365 and Power Platform: The Ultimate Guide to Apply Predictive Analytics,"[Aurelien Clere,Vinnie Bansal et al.]",37.51,3.3
Machine Learning with TensorFlow Second Edition,[Mattmann A. Chris],46.61,4.2
Machine Learning: Architecture in the age of Artificial Intelligence,[Phil Bernstein],46.95,4.7
Machine Learning: An Applied Mathematics Introduction,[Paul Wilmott],19.99,4.5
Practical MLOps: Operationalizing Machine Learning Models,"[Noah Gift,Alfredo Deza]",45.18,3.9
An Introduction to Statistical Learning: with Applications in R (Springer Texts in Statistics),,72.02,4.6
Python Machine Learning Example: Build intelligent systems using Python TensorFlow 2 PyTorch and scikit-learn 3rd Edition,[Yuxi (Hayden) Liu],34.99,4.5
The Elements of Statistical Learning: Data Mining Inference and Prediction Second Edition (Springer Series in Statistics),,61.93,4.6
PYTHON CRASH COURSE: A PRACTICAL BEGINNERS GUIDE TO LEARN PYTHON IN 7 DAYS OR LESS INTRODUCING YOU INTO THE WORLD OF DATA SCIENCE ARTIFICIAL INTELLIGENCE AND MACHINE LEARNING WITH HANDS-ON PROJECT,[ERICK THOMPSON],14.99,3.8
Artificial Intelligence: A Textbook,[Charu C. Aggarwal],53.54,4.1
Advanced Statistics for Health Research,"[Richard J. Butler,Matthew J. Butler et al.]",108,
Patterns Predictions and Actions: Foundations of Machine Learning,"[Moritz Hardt,Benjamin Recht]",49.99,
Python Feature Engineering Cookbook: Over 70 recipes for creating engineering and transforming features to build machine learning models,[Soledad Galli],39.99,4
Machine Learning: Master Supervised and Unsupervised Learning Algorithms with Real Examples (English Edition),"[Dr Ruchi Doshi,Dr Kamal Kant Hiran et al.]",19.95,3.8
Text as Data: A New Framework for Machine Learning and the Social Sciences,"[Justin Grimmer,Margaret E. Roberts et al.]",35.99,4.8
Machine Learning from Weak Supervision: An Empirical Risk Minimization Approach (Adaptive Computation and Machine Learning series),"[Masashi Sugiyama,Han Bao et al.]",65,
Introduction to Machine Learning fourth edition (Adaptive Computation and Machine Learning series),,57.99,4.7
Quantum Computing for Programmers,[Robert Hundt],45.3,4.3
Computer Programming for Beginners: Fundamentals of Programming Terms and Concepts,[Nathan Clark],18.99,4.4
Practical Simulations for Machine Learning: Using Synthetic Data for AI,"[Paris Buttfield-Addison,Mars Buttfield-Addison et al.]",46.49,5
Machine Learning: A First Course for Engineers and Scientists,"[Andreas Lindholm,Niklas Wahlström et al.]",69.99,5
Beyond the Basic Stuff with Python: Best Practices for Writing Clean Code,[Al Sweigart],30.22,4.7
Fluent Python: Clear Concise and Effective Programming,[Luciano Ramalho],50.99,4.7
Python Distilled (Developers Library),[David Beazley],46.82,4.6
Python and Algorithmic Thinking for the Complete Beginner (2nd Edition): Learn to Think Like a Programmer,[Aristides S Bouras],48.98,4.5
Python Basics: A Practical Introduction to Python 3,"[David Amos,Dan Bader et al.]",37.99,4.7
Mathematical Logic through Python,[Gonczarowski Yannai A.],29.99,5
Python Programming: An Introduction to Computer Science 3rd Ed.,[John Zelle],42.75,4.6
Python Object-Oriented Programming: Build robust and maintainable object-oriented Python applications and libraries 4th Edition,"[Steven F. Lott,Dusty Phillips]",38.24,4.3
Think Python: How to Think Like a Computer Scientist,,28.99,4.6
Learn Python Programming: An in-depth introduction to the fundamentals of Python 3rd Edition,"[Fabrizio Romano,Heinrich Kruger]",37.11,4.2
Mastering Financial Pattern Recognition: Finding and Back-Testing Candlestick Patterns with Python,[Sofien Kaabar],64.32,
Robust Python: Write Clean and Maintainable Code,[Patrick Viafore],32.99,4.5
Django 4 Example: Build powerful and reliable Python web applications from scratch 4th Edition,"[Antonio Mele,Bob Belderbos]",47.18,5
Python GUI Programming with Tkinter: Design and build functional and user-friendly GUI applications 2nd Edition,[Alan D. Moore],39.99,4.4
Learn Python 3 the Hard Way: A Very Simple Introduction to the Terrifyingly Beautiful World of Computers and Code (Zed Shaws Hard Way Series),,31.99,4.4
Python in a Nutshell: A Desktop Quick Reference,"[Alex Martelli,Anna Ravenscroft et al.]",79.99,
Teach Yourself VISUALLY Python (Teach Yourself VISUALLY (Tech)),"[Ted Hart-Davis,Guy Hart-Davis]",30,
Advanced Python Scripting for ArcGIS Pro,[Paul A. Zandbergen],40.99,4.4
Infrastructure as Code Patterns and Practices: With examples in Python and Terraform,[Rosemary Wang],56.99,4.8
Effective Python: 90 Specific Ways to Write Better Python (Effective Software Development Series),,40.86,4.7
Architecture Patterns with Python: Enabling Test-Driven Development Domain-Driven Design and Event-Driven Microservices,"[Harry Percival,Bob Gregory]",44.37,4.6
Computational Cell Physiology: With Examples In Python,[Stephen M Baylor],39,5
The Book of Dash: Build Dashboards with Python and Plotly,"[Adam Schroeder,Christian Mayer et al.]",34.99,
Python for Programmers: with Big Data and Artificial Intelligence Case Studies,,37.41,4.4
Mastering Python: Write powerful and efficient code using the full range of Pythons capabilities 2nd Edition,[Rick van Hattem],42.74,4.7
Murachs Python Programming,"[Michael Urban,Joel Murach et al.]",34.3,4.5
El lenguaje de programación Python de principio a fin (Spanish Edition),[Angel Pablo Hinojosa Gutiérrez],18.83,5
Building Versatile Mobile Apps with Python and REST: RESTful Web Services with Django and React,[Art Yudin],39.99,4
Kalman Filter Made Easy: A Beginners Guide to the Kalman Filter and Extended Kalman Filter with Real Life Examples Supported Python Source Code,[William Franklin],29.99,3.5
Scaling Python with Ray: Adventures in Cloud and Serverless Patterns,"[Holden Karau,Boris Lublinsky]",56.26,
Data Visualization with Python and JavaScript: Scrape Clean Explore and Transform Your Data,[Kyran Dale],56.26,
The Well-Grounded Python Developer,[Doug Farrell],49.99,
Algorithmic Short Selling with Python: Refine your algorithmic trading edge consistently generate investment ideas and build a robust long/short product,"[Laurent Bernut,Michael Covel]",49.39,4.9
Publishing Python Packages: Test share and automate your projects,[Dane Hillard],49.99,
Create GUI Applications with Python & Qt6 (PyQt6 Edition): The hands-on guide to making apps with Python,,39,4
Mastering Object-Oriented Python: Build powerful applications with reusable code using OOP design patterns and Python 3.7 2nd Edition,[Steven F. Lott],33.48,4.6
Mastering Python for Networking and Security: Leverage the scripts and libraries of Python version 3.7 and beyond to overcome networking and security issues 2nd Edition,[José Manuel Ortega],39.99,4.9
Quantum Chemistry and Computing for the Curious: Illustrated with Python and Qiskit® code,"[Keeper L. Sharkey,Alain Chance et al.]",47.99,4.8
Metaprogramming with Python: A programmers guide to writing reusable code to build smarter applications,[Sulekha AloorRavi],44.99,
Building Python Web APIs with FastAPI: A fast-paced guide to building high-performance robust web APIs with very little boilerplate code,[Abdulazeez Abdulazeez Adeshina],39.99,4.4
Dead Simple Python: Idiomatic Python for the Impatient Programmer,[Jason C McDonald],59.99,
Python for Cybersecurity: Using Python for Cyber Offense and Defense,[Howard E. Poston III],18.74,4.6
Cracking Codes with Python: An Introduction to Building and Breaking Ciphers,[Al Sweigart],19.37,4.7
Web Scraping with Python: Collecting More Data from the Modern Web,[Ryan Mitchell],33.49,4.6
Data Structures and Algorithms in Python,"[Roberto Tamassia,Michael H. Goldwasser et al.]",99.88,4.3
Python Workout: 50 ten-minute exercises,[Reuven M. Lerner],56.99,4.9
Real-World Python: A Hackers Guide to Solving Problems with Code,[Lee Vaughan],24.49,4.7
Full-Color Illustration Data Structrues & Algorithms Python: Easy and Interesting to Learn Through Full-Color Diagrams (Python Foundation & Design Patterns & Data Structures & Algorithms),[yang hu],49.99,
Python Programming and Visualization for Scientists,"[Alex Decaria,Grant W Petty et al.]",44.43,5
Easy Learning Python 3: Python for Beginners Guide (Easy Learning Python and design patterns and data structures and algorithms),[yang hu],18.53,3.9
Learn More Python 3 the Hard Way: The Next Step for New Python Programmers (Zed Shaws Hard Way Series),,37.99,4.6
Scientific Computing with Python: High-performance scientific computing with NumPy SciPy and pandas 2nd Edition,"[Claus Führer,Jan Erik Solem et al.]",39.99,4.6
Mastering Python for Bioinformatics: How to Write Flexible Documented Tested Python Code for Research Computing,[Ken Youens-Clark],61.18,5
Head First Python: A Brain-Friendly Guide,[Paul Barry],50.62,4.6
Learning Python with Raspberry Pi,"[Alex Bradbury,Ben Everard]",17.39,4.2
Data Visualization in Python,[Daniel Nelson],37.99,3.3
Intuitive Python: Productive Development for Projects that Last,[David Muller],17.59,5
Python for Microcontrollers: Getting Started with MicroPython,[Donald Norris],16.63,4.2
Python Testing with pytest: Simple Rapid Effective and Scalable,[Brian Okken],37.06,4.5
Python Cookbook Third Edition,,50.68,4.6
Python in easy steps,,10.66,4.6
Python Programming: The Ultimate Beginners Guide to Learn Python Programming Step--Step (Computer Programming),,25.99,4.5
Advanced Python Programming: Accelerate your Python programs using proven techniques and design patterns 2nd Edition,[Quan Nguyen],49.99,4.3
High Performance Python: Practical Performant Programming for Humans,"[Micha Gorelick,Ian Ozsvald]",28.49,4.7
Doing Math with Python: Use Programming to Explore Algebra Statistics Calculus and More!,[Amit Saha],28.02,4.5
Learn Quantum Computing with Python and IBM Quantum Experience: A hands-on introduction to quantum computing and writing your own quantum programs with Python,[Robert Loredo],41.99,4.5
Interpretable Machine Learning with Python: Build explainable fair and robust high-performance models with hands-on real-world examples 2nd Edition,[Serg Masís],49.99,
Programming with MicroPython: Embedded Programming with Microcontrollers and Python,[Nicholas H. Tollervey],39.49,4.1
Using Python for Principles of Econometrics,[Constantin Colonescu],29.4,5
Network Programming in Python: The Basic: A Detailed Guide to Python 3 Network Programming and Management (English Edition),[John Galbraith],24.95,
Classic Computer Science Problems in Python,[David Kopec],29.99,4.4
Hyperparameter Tuning with Python: Boost your machine learning models performance via hyperparameter tuning,[Louis Owen],44.99,5
Ethical Hacking: A Hands-on Introduction to Breaking In,[Daniel G. Graham],32.99,4.8
Python Flash Cards: Syntax Concepts and Examples,[Eric Matthes],24.48,4.7
The Pythonic Way: An Architect’s Guide to Conventions and Best Practices for the Design Development Testing and Management of Enterprise Python Code (English Edition),[Sonal Raj],29.95,5
Flask Web Development: Developing Web Applications with Python,[Miguel Grinberg],36.49,4.5
Python Scripting for ArcGIS Pro,[Paul A. Zandbergen],50.99,4.5
Artificial Intelligence in Finance: A Python-Based Guide,[Yves Hilpisch],45.5,4.3
Algorithms Python (2 Edition): Easy to learn algorithms through full-color diagrams. (Easy Learning Python and design patterns and data structures and algorithms),[yang hu],49.99,
Algorithmic Trading with Python: Quantitative Methods and Strategy Development,[Chris Conlan],28.49,4.2
Quantitative Finance with Python: A Practical Guide to Investment Management Trading and Financial Engineering (Chapman and Hall/CRC Financial Mathematics Series),[Chris Kelliher],96,
Violent Python: A Cookbook for Hackers Forensic Analysts Penetration Testers and Security Engineers,"[""TJ OConnor""]",46.56,4.5
Programming ArcGIS Pro with Python (2nd Edition),[Eric Pimpler],44,5
Foundations of Statistics for Data Scientists: With R and Python (Chapman & Hall/CRC Texts in Statistical Science),,98.36,5
Interactive Data Visualization with Python: Present your data as an effective and compelling story 2nd Edition,"[Abha Belorkar,Sharath Chandra Guntuku et al.]",44.99,4.3
PYTHON PROGRAMMING: 3 BOOKS IN 1: The Complete guide to Learn Everything you Need to Know about Python,[Clive Campbell],29.99,4.4
A Smarter Way to Learn Python: Learn it faster. Remember it longer.,[Mark Myers],19.95,4.6
Fundamentals of Python: First Programs,[Kenneth A. Lambert],69.07,4.4
IoT and Edge Computing for Architects: Implementing edge and IoT systems from sensors to clouds with communication systems analytics and security 2nd Edition,[Perry Lea],44.99,4.5
Digital Forensics and Incident Response: Incident response techniques and procedures to respond to modern cyber threats 2nd Edition,[Gerard Johansen],39.99,4.6
Learn JavaScript Quickly: A Complete Beginner’s Guide to Learning JavaScript Even If You’re New to Programming (Crash Course With Hands-On Project),[Code Quickly],16.89,4.5
Genetic Algorithms with Python,[Clinton Sheppard],19.97,4.4
Python 3 Standard Library Example The (Developers Library),,51.29,4.5
Python in 24 Hours Sams Teach Yourself,,30.46,4.2
Introduction to Computation and Programming Using Python third edition: With Application to Computational Modeling and Understanding Data,[John V. Guttag],52.25,4.6
Python: All That Jumping,[John Yoon Ph.D.],37.95,
Learn Python Quickly: A Complete Beginner’s Guide to Learning Python Even If You’re New to Programming (Crash Course With Hands-On Project),,17.27,4.4
Mastering GUI Programming with Python: Develop impressive cross-platform GUI applications with PyQt,[Alan D. Moore],39.99,4.3
Problem Solving with Algorithms and Data Structures Using Python SECOND EDITION,"[Bradley N. Miller,David L. Ranum]",42.75,4.6
Clean Code in Python: Develop maintainable and efficient code 2nd Edition,[Mariano Anaya],44.64,4.6
Continuous Delivery with Docker and Jenkins: Create secure applications building complete CI/CD pipelines 2nd Edition,[Rafal Leszko],46.99,4.4
Python for SAS Users: A SAS-Oriented Introduction to Python,"[Randy Betancourt,Sarah Chen]",37.99,4.4
Fundamentals of Python: Data Structures (MindTap Course List),[Kenneth Lambert],71.99,4.2
Microsoft Power BI Cookbook: Gain expertise in Power BI with over 90 hands-on recipes tips and use cases 2nd Edition,"[Greg Deckler,Brett Powell]",49.39,4.7
Dive Into Algorithms: A Pythonic Adventure for the Intrepid Beginner,[Bradford Tuckfield],24.99,4.5
Learn to Code Solving Problems: A Python Programming Primer,[Daniel Zingaro],23.06,4.7
Hands-On Data Preprocessing in Python: Learn how to effectively prepare data for successful data analytics,[Roy Jafari],49.99,5
Practical Python Programming for IoT: Build advanced IoT projects using a Raspberry Pi 4 MQTT RESTful APIs WebSockets and Python 3,[Gary Smart],39.99,4.4
Hands-On Explainable AI (XAI) with Python: Interpret visualize explain and integrate reliable AI for fair secure and trustworthy AI apps,[Denis Rothman],49.99,3.8
Python for Data Analysis: A Beginners Guide to Master the Fundamentals of Data Science and Data Analysis Using Pandas Numpy and Ipython (Programming Languages for Beginners),,17.97,4.3
Python Interview Questions: Brush up for your next Python interview with 240+ solutions on most common challenging interview questions (English Edition),[Swati Saxena],29.95,3.1
Python: 2 Manuscripts in 1 book: -Python For Beginners -Python 3 Guide,[Timothy C. Needham],24.95,4.1
Practical Discrete Mathematics: Discover math principles that fuel algorithms for computer science and machine learning with Python,,56.69,4.3
Python Automation Cookbook: 75 Python automation ideas for web scraping data wrangling and processing Excel reports emails and more 2nd Edition,[Jaime Buelta],39.99,4.4
DATA STRUCTURE AND ALGORITHMS: BUILD IN PYTHON,"[Dr. RACHANA KAMBLE,AYUSHI GODIYA et al.]",8.66,
Python One-Liners: Write Concise Eloquent Python Like a Professional,[Christian Mayer],35.81,4.8
Expert Python Programming: Master Python learning the best coding practices and advanced programming concepts 4th Edition,"[Michal Jaworski,Tarek Ziade]",39.94,4.5
Simulation with Python: Develop Simulation and Modeling in Natural Sciences Engineering and Social Sciences,"[Rongpeng Li,Aiichiro Nakano]",39.99,
Web Development with Django: Learn to build modern web applications with a Python-based framework,"[Ben Shaw,Saurabh Badhwar et al.]",41.99,4.5
Python for Algorithmic Trading: From Idea to Cloud Deployment,[Yves Hilpisch],44.49,4.3
Clean Code: A Handbook of Agile Software Craftsmanship,,47.49,4.7
Serious Python: Black-Belt Advice on Deployment Scalability Testing and More,[Julien Danjou],29.24,4.7
Python Natural Language Processing Cookbook: Over 50 recipes to understand analyze and generate text for implementing language processing tasks,[Zhenya Antić],37.99,4.2
Python Crash Course 3rd Edition,[Eric Matthes],40.49,
The Recursive Book of Recursion: Ace the Coding Interview with Python and JavaScript,[Al Sweigart],36.94,5
Bayesian Analysis with Python: Introduction to statistical modeling and probabilistic programming using PyMC3 and ArviZ 2nd Edition,[Osvaldo Martin],44.99,4.1
Python: For Beginners: A Crash Course Guide To Learn Python in 1 Week,[Timothy C. Needham],17.97,4.3
Murachs Python Programming (2nd Edition),"[Joel Murach,Michael Urban]",56.53,4.6
Mastering Reinforcement Learning with Python: Build next-generation self-learning models using reinforcement learning techniques and best practices,[Enes Bilgin],46.99,4.4
Introduction to Radar With Python and Matlab,[Lee Andrew Harrison],154.23,4.1
Python Pocket Reference: Python In Your Pocket (Pocket Reference (OReilly)),,13.79,4.5
Python for DevOps: Learn Ruthlessly Effective Automation,"[Noah Gift,Kennedy Behrman et al.]",35.99,4.5
The Python Bible 7 in 1: Volumes One To Seven (Beginner Intermediate Data Science Machine Learning Finance Neural Networks Computer Vision),[Florian Dedov],37.99,4.5
Mastering Python Networking: Your one-stop solution to using Python for network automation programmability and DevOps 3rd Edition,"[Eric Chou,Michael Kennedy et al.]",55.09,4.6
Automate the Boring Stuff with Python 2nd Edition: Practical Programming for Total Beginners,[Al Sweigart],26.49,4.7
Introducing Python: Modern Computing in Simple Packages,[Bill Lubanovic],24.49,4.7
Statistics for People Who (Think They) Hate Statistics,,31.99,4.5
Statistics For Dummies (For Dummies (Lifestyle)),,11.99,4.3
Statistics for Absolute Beginners (Second Edition) (Data Science Python & Statistics for Beginners),[Oliver Theobald],14.88,4.4
Introduction to Probability Statistics and Random Processes,[Hossein Pishro-Nik],36.58,4.6
Princeton Review AP Statistics Prep 2022: 4 Practice Tests + Complete Content Review + Strategies & Techniques (2022) (College Test Preparation),[The Princeton Review],18.99,4.6
5 Steps to a 5: AP Statistics 2023,"[Jared Derksen,DeAnna Krause McDonald]",18,
The Foundations of Statistics,[Leonard J. Savage],11.89,4.5
Princeton Review AP Statistics Prep 2023: 5 Practice Tests + Complete Content Review + Strategies & Techniques (College Test Preparation),[The Princeton Review],18.99,4.6
Mathematical Statistics with Applications,"[Dennis Wackerly,William Mendenhall et al.]",95.66,4.2
Statistics in Plain English,[Timothy C. Urdan],39.16,4.7
Statistics Workbook For Dummies with Online Practice,[Deborah J. Rumsey],18.99,4.3
UPDATED Version of The Practice of Statistics,"[Daren S. Starnes,Josh Tabor]",179.95,4.4
Data Mining for Business Analytics: Concepts Techniques and Applications in R,"[Galit Shmueli,Peter C. Bruce et al.]",105.45,4.4
Probability and Statistics for Economists,[Bruce Hansen],60,
Painless Statistics (Barrons Painless),[Patrick Honner],14.99,5
Discovering Statistics Using IBM SPSS Statistics: North American Edition,[Andy Field],64.7,4.4
AP Statistics Flashcards Fourth Edition: Up-to-Date Practice + Sorting Ring for Custom Study (Barrons Test Prep),[Martin Sternstein Ph.D.],29.99,
Outline of Basic Statistics: Dictionary and Formulas (Dover Books on Mathematics),"[John E. Freund,Frank J. Williams]",11.95,4.2
Essentials of Statistics,[Mario Triola],170.15,4.5
Statistics for People Who (Think They) Hate Statistics: Using Microsoft Excel,"[Neil J. Salkind,Bruce B. Frey]",84.85,4.4
Statistics for the Behavioral Sciences - Standalone Book,"[Frederick J Gravetter,Larry B. Wallnau]",94.46,4.5
Statistics for Business and Economics,"[James McClave,P. George Benson et al.]",223.99,4.3
The Little SAS® Book: A Primer Sixth Edition,"[Lora D. Delwiche,Susan J. Slaughter]",54.1,4.6
Applied Statistics II: Multivariable and Multivariate Techniques,[Rebecca M. Warner],95.92,4.3
A Gentle Introduction to Stata,[Alan C. Acock],69.56,4.6
Clinical Biostatistics and Epidemiology Made Ridiculously Simple: An Incredibly Easy Way to Learn for Medical Nursing PA Students And Other Healthcare Professionals (MedMaster Medical Books),"[Ann Weaver Ph.D.,Stephen Goldberg M.D.]",21.8,4.5
CRC Standard Probability and Statistics Tables and Formulae,"[Daniel Zwillinger,Stephen Kokoska]",188.73,4.9
Fundamentals of Programming in SAS: A Case Studies Approach,"[James Blum,Jonathan Duggins]",109.95,4.4
Statistics Done Wrong: The Woefully Complete Guide,[Alex Reinhart],19.99,4.5
Learning SAS Example: A Programmers Guide Second Edition,[Ron Cody],81.53,4.6
Statistics II For Dummies,[Deborah J. Rumsey],16.66,4.4
Stats: Modeling the World,"[David Bock,Paul Velleman et al.]",197.32,4.1
First Course in Probability A,[Sheldon Ross],215.32,4.2
ISE STATISTICS FOR ENGINEERS AND SCIENTISTS (ISE HED IRWIN INDUSTRIAL ENGINEERING),[William Navidi Prof.],37.17,4.2
Introduction to Probability (Cambridge Mathematical Textbooks),,70.99,4.3
Causal Inference: The Mixtape,[Scott Cunningham],31.99,4.6
Introduction to Mathematical Statistics and Its Applications An,"[Richard Larsen,Morris Marx]",159.99,4.4
AP® Statistics Crash Course Book + Online: Get a Higher Score in Less Time (Advanced Placement (AP) Crash Course),,14.16,4.8
Introduction to the Practice of Statistics,"[David S. Moore,George P. McCabe et al.]",240.34,3.6
Data Mining for Business Analytics: Concepts Techniques and Applications with XLMiner,"[Peter C. Bruce,Galit Shmueli et al.]",110.83,4
Study Guide to Accompany Salkind and Frey′s Statistics for People Who (Think They) Hate Statistics,,30,4.3
Elementary Statistics: A Step Step Approach,[Allan Bluman],129,4.5
Practice Makes Perfect Statistics (Practice Makes Perfect (McGraw-Hill)),,14.06,4.6
Mathletics: How Gamblers Managers and Fans Use Mathematics in Sports Second Edition,"[Wayne L. Winston,Scott Nestler et al.]",18.99,4.8
Schaums Outline of Statistics Sixth Edition (Schaums Outlines),,25.48,4.2
Biostatistics for the Biological and Health Sciences,"[Marc Triola,Mario Triola et al.]",179.14,4.5
An Introduction to Formal Languages and Automata,[Peter Linz],62.85,4.4
Doing Quantitative Research in the Social Sciences: An Integrated Approach to Research Design Measurement and Statistics,[Thomas R. Black],55.54,4.4
Basic Business Statistics: Concepts and Applications (Whats New in Business Statistics),,100.99,4.4
Essentials of Statistics for the Behavioral Sciences (MindTap Course List),"[Frederick J Gravetter,Larry B. Wallnau et al.]",85.79,4.4
Statistics for Business and Economics Global Edition,"[Paul Newbold,William Carlson et al.]",74.96,4.6
Statistics Translated: A Step--Step Guide to Analyzing and Interpreting Data,[Steven R. Terrell],55,4.8
Statistics for the Behavioral Sciences,[Gregory J. Privitera],138.99,4.4
Modern Mathematical Statistics with Applications (Springer Texts in Statistics),"[Jay L. Devore,Kenneth N. Berk et al.]",121.11,4
Practical Statistics For Educators,[Ruth Ravid],50,4.6
Statistics Made Simple for School Leaders: A New Approach for Using Student Staff and Community Data 3rd Edition,"[Susan Rovezzi Carroll,David J. Carroll]",35,5
Using SPSS for Windows and Macintosh (7th Edition),"[Samuel B. Green,Neil J. Salkind]",279.95,4.4
An Adventure in Statistics: The Reality Enigma,[Andy Field],52,4.7
How to Work With Probability and Statistics Grades 6-8 (Math How To...),[Robert W. Smith],8.99,3.2
Essential Statistics for the Behavioral Sciences,[Gregory J. Privitera],100,4.4
Asymptotic Statistics (Cambridge Series in Statistical and Probabilistic Mathematics Series Number 3),,67.99,4.6
